{
  "$schema":"https://json-schema.org/draft/2020-12/schema",
  "$id":"https://oresoftware.com/contracts/server-filesystem-routing/api-v1.schema.json",
  "type":"object","additionalProperties":false,
  "required":["schema_version","server_kind","route_root","files","url","generation"],
  "properties":{
    "schema_version":{"const":"ores.server-filesystem-routing.v1"},
    "server_kind":{"enum":["api","admin_api"]},
    "route_root":{"const":"src/routes"},
    "files":{"type":"object","additionalProperties":false,"required":["authored","generated"],"properties":{"authored":{"const":["handlers.rs","route.rs"]},"generated":{"const":["rpc.rs","lambda.rs"]}}},
    "url":{"type":"object","additionalProperties":false,"required":["static_segment","dynamic_segment","catch_all_segment","optional_catch_all_segment","parameter_name_charset","duplicate_parameter_names","catch_all_must_be_final","hidden_route_groups","one_to_one_url_mapping"],"properties":{"static_segment":{"const":"literal-directory-name"},"dynamic_segment":{"const":"[name]"},"catch_all_segment":{"const":"[...name]"},"optional_catch_all_segment":{"const":"[[...name]]"},"parameter_name_charset":{"const":"ascii_alnum_underscore_hyphen"},"duplicate_parameter_names":{"const":false},"catch_all_must_be_final":{"const":true},"hidden_route_groups":{"const":false},"one_to_one_url_mapping":{"const":true}}},
    "generation":{"type":"object","additionalProperties":false,"required":["orchestrator","rpc_owner","lambda_owner","rpc_source_authority","lambda_source_authority","route_projection","provider_neutral_lambda","rpc_generated_marker","lambda_generated_marker"],"properties":{"orchestrator":{"const":"ores-stack"},"rpc_owner":{"const":"ores-stack"},"lambda_owner":{"const":"ores-stack"},"rpc_source_authority":{"const":"handlers.rs"},"lambda_source_authority":{"const":"handlers.rs"},"route_projection":{"const":"route.rs"},"provider_neutral_lambda":{"const":true},"rpc_generated_marker":{"const":"// @generated by ores-stack sync; do not edit"},"lambda_generated_marker":{"const":"// @generated by `ores-stack api lambda sync`; DO NOT EDIT."}}}
  }
}
